Dear @ORGANIZATION1, The computer blinked to life and an image of a blonde haired girl filled the screen. It was easy to find out how life was in @LOCATION2, thanks to the actual @CAPS1 girl explaining it. Going to the library wouldn't have filled one with this priceless information and human interection. Computers are a nessessity of life if soceity wishes to grow and expand. They should be supported because they teach hand eye coordination, give people the ability to learn about faraway places, and allow people to talk to others online. Firstly, computers help teach hand eye coordination. Hand-eye coordination is a useful ability that is usod to excel in sports. In a recent survey, @PERCENT1 of kids felt their hand eye coordination improves after computer use. Even a simple thing like tying can build up this skill. Famous neurologist @CAPS2 @PERSON1 stated in an article last week that, "@CAPS3 and computer strength the @CAPS2. When on the computer, you automatically process what the eyes see into a command for your hands." @CAPS4 hand eye coordination can improve people in sports such as baseball and basketball. If someone wan't to become better in these sports, all they'd need to do was turn on the computer. Once people become better at sports, they're more likely to play them and become more healthy. In reality, computers can help with exercising instead of decreasing it. Additionaly, computers allow people to access information about faraway places and people. If someone wanted to reasearch @LOCATION1, all they'd need to do was type in a search would be presented to them in it would link forever to search through countless things. Also, having the ability to learn about cultures can make peole peole and their cultures, they understand others something. Increase tolerance people are. Computers are a resourceful tool that they can help people in every different aspect of life. Lastly, computer and in technology can allow people to chat. Computer chat and video chat can help the all different nations. Bring on good terms places other than can help us understand story comes out about something that happend in @LOCATION3, people can just go on their computer and ask an actual @LOCATION3 citizen their take on the matter. Also, video chat and online conversation can cut down on expensive phone bills. No one wants to pay more than they have to in this economy. Another good point is that you can acess family members you scaresly visit. It can help you connect within your own family more. Oviously, computers are a useful aid in todays era. their advancements push the world foreward to a better place. Computers can help people because they help teach handeye coordination, give people the bility to learn about faraway places and people, and allow people to talk online with others. Think of a world with no computers or technologicall advancements. The world would be sectored and unified, contact between people scare, and information even. The internet is like thousands or librarys put together. Nobody would know much about other nations and news would travel slower. Is that the kind of palce you want people to live in?
Dear @ORGANIZATION1, @CAPS1 has been brought to my attention that some people feel that computers are bad for us. Some people say that they are a distraction to our physicaland mental health. Although I can see how some people would think this, I believe that computers are a good benifit to all society. I believe this because computers can help people learn, stay intach with friends or family that live faraway, and stay orginized. Sometimes people are on the computer, learning and they don't even know @CAPS1. Simply by visiting the @ORGANIZATION2 homepage, you automaticly see the news feeds of things happening around the world. Other times people go online diliberatly to learn. If someone is thinking about going to @LOCATION1 then they would probably go on the internet to learn about @CAPS1. Simply by searching equadore many choices will pop up you climate, sesonal weather, hotel options, and other farts. But thats not the only way people are learning on the internet. Now, many college students have the option of taking their lessons online. This is because some students like calm quietness or own house the distractions of sitting in class. Friends could be a big distraction in class, but how can you stay intouch with your friends if they moved away? I remember in second grade my bestfriend, @LOCATION2, move away. I was so sad. I badey ever talked to her, but then one day our parents set us up on a vidio chat! I felt like I was right their with her! This was great, and I though about how many people could use this to talk to relatives or friends. Another great way to stay intouch into friends and family is through e-mail. By writing a message and sending @CAPS1 can make staying in touch so easey, and your personal wants can chat and emails are a easey thing to send world wide. So many people love to type on a keyboard as well, but so many different papers that you type could be lost. I, for me, hate clutter, and I have so many school binders for papers to be lost in. This is why I take great advantage of typing my paper every chance I get. My computer keeps me orginiced because I could never loose my work. File save, is an idiot proof way to keep all your files in a safe place. Then all you have to do is press print to get a hard copy. I am sure that many people love using their computer for the same reason. Also, I myself am a much faster typer than I am writer so my work is a lot needey on the computer. As you can see their are plenty of reasons why using a computer is goof for our society you can learn, stay intouch with friends and family, and stay orginiced. Many people, could agree with me. Don't you?
Dear @CAPS1 @CAPS2, @CAPS3 life without computers. There would be no quick access to information, no way to socialize, and no way to keep your health records or other personal information safe. Without this technology where would we be? I believe that the world is benefiting from the advances in technology today. As a student, computers are a crucial element to allow me to get my work done. without the guidance from @ORGANIZATION2 @CAPS7, @CAPS4 @CAPS5, or other applications, @CAPS6 woudn't be possible for me to reach my full potential a assignments. How could a student be so certain their grammar is perfect on their homework without asking a teacher? There is a way. It is called @ORGANIZATION2 tools. However, the only way to access this is through a computer or @ORGANIZATION2 @CAPS7 @ORGANIZATION2 tools allows you to check your spelling, grammar, and punctuation with just a click of your mouse. Computers are an essential learning tool for school system today. Not only are computers used to educate, but they are helpful in the real world. Many business rely on the work of Computers entirely. In facts, @CAPS8 to @PERSON1 @CAPS9 @ORGANIZATION1, a local business "@LOCATION1," In our job, we continuously we work with. this wouldn't be possible without the effort of our typist on the computer. "@CAPS6 business and companies around the nation are relying on the advances in technology, why change anything? We should continue to progress in this groth @PERCENT1 of business in @LOCATION1 say they would have to close dawn @CAPS6 not for computers with so many business doing this, our economy would drop. This would not help. We all know computers and other technology are great sources of entertainments. What you @MONTH1 not now, however, is that they supply a great amount of knowledge to the average person. For example, lets say you finished watching a special on the discovery channel about @LOCATION2. You want to know more, so you pull out your iPod touch. All you have to do is log on to the internet and search "@CAPS11 of @LOCATION3, @LOCATION2" @CAPS12 seconds, you would have your information. People @MONTH1 not believe so, but it is true that you canlearn a great deal of information from various forms of technology. You can have all the resources you'll ever reed right at your fingertips. Computer supply so much more then just entertainment. All reasonable people would agree advances in technology are extremely helpul to the public. there is so much guidance for our daily lines through computers.
Dear Local Newspaper @CAPS1, @CAPS2 our technology advance, so do are lives. Computers are a perfect way to better our way of life in ways that are benificial to us and future generations. The use of computers, and the @CAPS5 alone allow us to learn about the way of life in other places on @LOCATION4 talk to people faraway, and express ourselves. Computers give us a bright future. First many people, actually @PERCENT1 of the worlds population are generally stationary, and line in a local town or city environments. This is why computers are so helpful because they give @CAPS2 a way to research other places around the globe. @CAPS3 can create an interest in other cultures, and shape our opinions @CAPS2 @CAPS3 discover things about other places. From there, @CAPS3 can look at different topics in a wide spread point of view. In doing this @CAPS3 will connect to other ways of life. @CAPS2 philosopher and poet @PERSON1 state" @CAPS3 learn about ourselves through the discovery of others." @CAPS4, another particularly handy function of the @CAPS5 through computers is @CAPS3 can communicate with people who live far away, when @CAPS3 couldn't visit otherwise. A @LOCATION2 study showed that actually @PERCENT2 of use of the computer is communication with sites like facebook or @CAPS9. A scientist in @LOCATION3, @PERSON3, says @CAPS3 @CAPS2 humans tend to enjoy communication because it gives @CAPS2 a sense of unity. This is why so many companies are realizing that sites like @ORGANIZATION2, @CAPS6, and @ORGANIZATION1 are gaining in popularity." And this is true. It is enjoyable to @CAPS7, talk, or email others. Without computers, this couldn't be possible. Lastly, computers give us the chance to express our ideas like never before. Now, stars aren't only made in @LOCATION1, but now you can make yourself famous on @CAPS8 or @CAPS9. Just ask @PERSON2, who's voice reached out and caught the attention of a major record company. Now, everyone knows his name and listens to his music. Like @PERSON2, the more wordy folks can express themselves by blogging their opinions. " About half of computer use, " says @CAPS1 to computer weekly, @PERSON4," is using blogs and videos to state one's ideas." @CAPS3 can persuade others to think @CAPS2 @CAPS3 do and discover thngs that @CAPS3 have discovered. Self-expression is very important to society, and this is why computers have such an affect on people. @CAPS2 it is clear, computers have a positive affect on people and society. They allow us to learn about faraway places, communicate with others, and inspire the world around us with our ideas. Welcome to the future.
Hour after hour of gaming online and posting blogs on social networking sights is all one sees. Unaware at there surroundings, many people zone to their computer screens and only break @CAPS4 absolutely necessary. That is not what the world should become but that is what is society is creating. Computers do not create positive benefits to society. Because of all the time spent on the computer, people's bodies are taking the negative effects. There is also less and less face-to-face interactions with family and friends. Another huge issue is cyber bulling. These are all problems that should be addressed. With all the time spend on a computer in a stuffy, dark room, how will our bodies be maintained properly? Exercise is a key ingriedient to healthy living. It is like trying to make bread without flour, without that necessity the bread will not rise its full potential. It is the same with the health and functions at our bodies. Exercise must be took part in to burn fat and calories, but it is also needed to build and maintain muscles. In fact, muscles start it is recommended to get in at least one hour of exercise of outside play a days. Not many succeed with this goal, which brings up another negative effect to the body. @CAPS2 @CAPS1 helps to maintain strong bones. To get the recommended dose of @CAPS2 @CAPS1 a day you only need to absorb @NUM1 minutes of sunlight a day. It doesn't seem like a lot but @PERCENT1 of our population is not outside to recieve it. Instead, they are inside on their computers. Parties, lunch breaks, or even a family dinner are great times to socialize. But, what if one day you decided you were going to skip your lunch break with friends and instead spend time posting a daily blog. This is social time lost. If this habit continues you might soon see yourself drifting away from your friends because you don't make the time to spend lunch break with them. Even @CAPS4 a child interactions @CAPS4 chatting with friends on @CAPS5 or @CAPS6, anything could be said. Children wont learn at a young age how to think on there fact language. This will effect their later years @CAPS4 interviewing for things such as colleges or even jobs. Social skills are the difference between success and failure. Spending life on a computer is equivalent to being a caterpillar in their while at least attempting to be an extreme will turn you @CAPS7 and @CAPS7 are all created with the ominous cyberbulling. One simple way to prevent this is spending less time in the computer. The effects of cyber bulling can be brutal. A recent study showed that @PERCENT2 of kids would rather be bullied in face then over the internet. The reason being a of cruelty is displayed through cyberbulling over the internet because it takes much less courage to type something up then it for a bully to say something to them victims face. Such cyberbulling has even led to suicides. In fact, a girl in committed suicide due to cyber bulling just @NUM2 weeks ago. If you don't have In conclusion, computers produce more negative effect on society than good. A lack of exercise and proper body maintenance results. Reduced social interacting and skills also result. And maybe most importantly cyberbulling which takes lives occurs. In prevent society from turning into a social waste and felled with the glow of computer screens, lets all turn the monitor and get outside with nature and all its benefits.
Dear Local Newspaper, I believe that computers are an extremely useful tool in society. It helps people learn new things about different cultures. Also, it lets you communicate with friends and family through the internet, for example, using facebook or @CAPS1. Finally, it provides an accurate research tool for school projects, or interviews. First, learning about different cultures helps the world stay together. For example, here, we learn @CAPS2 and @CAPS3. Each class teaches us to respect more and more of this culture. However, some people don't have the chance to get this land of education, so they turn to the internet. If the computer didn't exist, we might not know about the lifestyle @NUM1 mi away from us. We wouldn't know if their lifestyles are extremely difficult or luxurious. Also, we wouldn't know if we could help them or not. For example, the earthquake in @LOCATION1 which. It's one step closer to world peace no more war or conflicts. Secondly, the computer helps you communicate to friends and family for in the world. I remember one time I was mailing my family friends who was in @LOCATION2, risking his life. I knew he couldn't come back to town, so I started to email him, and video chat with him. Whenever I saw his face, I knew that everything was okay. I don't know how I would have without the internet. Other ways lived you could as. Also, just communicating with friends! internet sites, like extremely useful. Finally, you use the computer for educational use. For example, research projects, study tools and essays. Whenever that a research is the internet. This extremely reliable and accurate. However that some of the websites are fake, which is easy to great research to use for school projects. Also, I know many teachers in my school have a blog or page where they put their @CAPS4 on, study links, and handouts, just in case we lose them. Whenever there is a test coming up, my @CAPS2 teacher, @CAPS5 would have links on her go to help use study. Also, is another website that helps us study for vocab. It also has many games that and learn our vocab words. As you can see, the computer helps us in our daily use and makes a positive impact on our society. From educational purposes, to learning cultures and socializing with friends it helps us get through life. As very successful newspaper and people, I assume you will understand how much the computer has made a positive effect in society.
Since computers were invented, a colossal change in the way society functions has taken place. People how can go on to their computers to communicate with peers, get information on any topic for a school paper, or just because the internet to watch videos and stories. Magazine and newspaper articles, books and even movies and shows sre available on today's computer! This advancement in technology has made the @NUM1 century the most modern era this world has ever seen, and is beneficial to society. The "computer age" has given people in today's society the incredible opportunity to broaden their imaginations through technology. You can, in less than one minute go on the internet type in to @ORGANIZATION1 whatever movie or book you want and start watching instantly. People have always said that books can take you anywhere you want. Well, the computers can do the same thing, expect with greater efficiency and with more places to choosen from. You can, instead of buying a book, go online and read of the faraway city of @LOCATION1, or of the eruption of the @CAPS1 @CAPS2, and you can do it with mind-blowing speed. Some think that by wasting time on computers, people are using up time that could be spent studying or with family. Howeer, any information needed to your knowledge on a topic can be found on the internet. And if you want to spent time with your family, you can even look your computer up to a tv and watch a free movie with the family! The computer age is here and it is exactly. What society needs. Picture this: you're doing a school project on the you know nothing about it. Would you rather drive minutes going and thirty minutes looking withb everything you need, or do you think it's more to spend five minutes looking for the website you need on the internet? Obviously, the later of the is much more reasonable. The computer makes getting research for school or work substantially easier. In addition,you can create entire presentations on a computers with surprising ease! Being an eighth grade student, I dont know I would ever do woithout the internet. I rely on my computer to get all of my research for almost every project, and I even make some of my best project on it! The computer is the likes of all the hard working students and adults much, much easier. People's lives have not only been made easier in the field of research; computer make communicating with friends and familyeasier as well! Through e-mail, video chat and instant messaging., we can communicate with whoever we would, whenever we wort. With some computers, you can even see and talk to any person you wish. Without these computers, we will one again have to resort to snail mail, whcih makes instant communication @CAPS3 telephones, we would have no other way to talk. Computers have enhanced communication chill likes so graetly that it's foolish to say their not beneficial to society. How can a machine with so many abilities be for see the computer as a brooden research for school and we want! Bottom line the computer age is here and its amazing.
Computers, @CAPS1 how far we've come. Computers hold many opertunities for the world and we don't use any of them. Computers have taken many and left them without excersize. Computers fasinate many and can become very adicting if not used only in moderation. Computers are also attention hogs and take away interaction with family. Imagine seven years of your life sitting in front of a computer. You never get up unless you absolutely need to. You even decide to cut the sports from your life. Now imagine what that does to your body. Even if you ate right, the never excersising part woudl kill you. I remember I was at my cousin @PERSON2's house when she sugested to play the game @CAPS2 fit. If you have never played this before, when you sign in, it does some tests and determines the age of your body. My body was @NUM1 years old. I was a @NUM2 years old in a @NUM1 year old body. All those years gone in front of the computer. I don't want that experience to happen to anouther. Don't make the same mistake as me readers of the @LOCATION1 current. I have a friend name @PERSON1, and she is a computer addict. She would spend days on end on the computer. Sometimes she'd miss school for the computer or come to school just to play on the computer. She'd sometimes get violent when someone tried to pull her away. I hated seeing my friend like this, but mostly I hated how I watched it happen. It started off innocent enough. She enjoyed a certain website on the internet. It would sometimes get scary when she talked to me about it and clearly had played it all night. If you are looking at this story and thinking that would never happen to me, your wrong. I was thinking the same way when I took a look at that website that got her started. Thankfully, I stoped my addiction before it got to serious, but many others like @PERSON1 could and will be absorbed by the computers. Many readers reading this right now, should understand how dangerous and read this is, "@CAPS3!.... @CAPS3!... I'm talking to you!" That is the sound of your family members trying to talk to you when your on the computer. It doesn't work, computers are so attention grabbing, you can't even stand to talk to your own family. My mom does this many times a day to grab my attention and ends up calling my cell phone or I.ming me. Thats really just sad. By doing this you also become detatched which is never a good thing. The more and more you ignore your family for the computer the less of a bond you'll have, the less of a life you'll have. Computers truly are amazing, but the loss of excersise is very unhealthy and rapidly happening. Computers can also be dangerous, many people will get addicted. The more you chat on chat room to strangers, the less you will talk to your family. Computers are the devils tools. They will most certainly destroy you, readers. Alway be careful, computers are not as they seem.
Lately, a technology buzz has hit all over the world. Where ever you look, be it at home, at school, at work, or on the streets, you see people texting, talking on phones, blogging, and other computer related things. This concerns some people. They believe that these generations are relying too much on computers and not spending enough time exercising outside or socializing. But here is where they go wrong. These experts are judging computers too harshly, for it's not like everyone is zoning out in front of a glass screen, sucked into the world beyond. @CAPS9, most of these "computer geeks" are using the computer for useful things, while they are also used for entertainment, computers also help society to reconnect with long-lost friends or even get directions to a well-know resuraunt. As you can plainly see, computers are not turning us all into zombies. Computers are sometimes seen as a nusence. Parents complain about the many times they have to drag their sons and daughters from the screen for dinner or a soccer game that started @NUM1 minutes ago. But you see, this doesn't mean its bad. Everyone goes on the computer. "Even though my father complains that I'm on @CAPS1 too much," @PERSON1, @ORGANIZATION1, says. "@CAPS2 forgets that @CAPS2 has one of his own." This is an example not unlike many other student's parents. About @PERCENT1 of adults confess that they too have fallen into the new fads such as @CAPS1, @CAPS4, and @CAPS5. So why do we need these things? What seems to make them so important to us? The answer is simple, it makes us feel connected. Then again, if you think about it, maybe not so simple. Many people have different opinions on why the computer is so important to them, but most agree that friends is one big factor. "Everyone is already online." @PERSON2, computer technician, informs. "@CAPS6 all your friends are in something, wouldn't you want to as well?" @CAPS7, as the famous saying, @CAPS8 your friends jumped off a bridge, would you?, flashes through your mind let me answer that for you - @CAPS9. Being connected and diving off the deep ends are too different concepts. As you find friends from highschool or just friends from school, your glad that @CAPS7 you can talk to them face to face - or computer screen to computer screen - again. Last, but certainly not least, the computer is a great resource. While some people complain, others are using what it has to offer by looking up directions to events or facts for your next report. This is how websites like @ORGANIZATION2 make billions from the words being typed into the search engine. The facts and places that arise from the computr are like gems waiting to be found. In conclusion, its easy to see why the computer and its resources are so loved. Everyone uses it for different things and different hobbies. Whilesome for pure entertainment, others for information, and another for reconnection. My personal favorite finiding the true treasure of hidden bands, the fantastic ones, that @CAPS9 one even knows. And so, this is why I'm convinced the computer is a positive impact on the world.
